{
  "version": "v1",
  "service": "checkout-orchestrator-service",
  "trace_id": "trace-20260508-001",
  "request_id": "request-20260508-001",
  "checkout_id": 1001,
  "checkout_key": "checkout-demo-20260508-001",
  "user_id": "user-1001",
  "status": "PROCESSING",
  "current_step": "AUTHORIZE_PAYMENT",
  "request_payload": {
    "checkout_key": "checkout-demo-20260508-001",
    "user_id": "user-1001",
    "items": [
      {
        "book_id": "book-001",
        "title": "Distributed Systems for Practitioners",
        "quantity": 1,
        "unit_price": 18000
      }
    ],
    "payment": {
      "amount": 18000,
      "currency": "KRW",
      "method": "MOCK_CARD"
    },
    "shipping_address": {
      "recipient": "Kim Seungyoon",
      "line1": "Gangnam-daero 123"
    }
  },
  "context_payload": {
    "order_id": "order-1001",
    "inventory_reservation_id": "reservation-1001"
  },
  "error_code": null,
  "error_message": null,
  "saga_version": 3,
  "created_at": "2026-05-08T00:00:00Z",
  "updated_at": "2026-05-08T00:00:05Z",
  "steps": [
    {
      "step_name": "CREATE_ORDER",
      "status": "SUCCEEDED",
      "step_category": "COMPENSATABLE",
      "recovery_policy": "BACKWARD",
      "idempotency_key": "checkout:1001:CREATE_ORDER",
      "request_payload": {
        "checkout_key": "checkout-demo-20260508-001"
      },
      "response_payload": {
        "order_id": "order-1001"
      },
      "retry_count": 0,
      "max_retry_count": 5,
      "next_retry_at": null,
      "error_code": null,
      "error_message": null,
      "external_reference_type": null,
      "external_reference_id": null,
      "started_at": "2026-05-08T00:00:01Z",
      "completed_at": "2026-05-08T00:00:02Z",
      "created_at": "2026-05-08T00:00:00Z",
      "updated_at": "2026-05-08T00:00:02Z"
    },
    {
      "step_name": "RESERVE_STOCK",
      "status": "SUCCEEDED",
      "step_category": "COMPENSATABLE",
      "recovery_policy": "BACKWARD",
      "idempotency_key": "checkout:1001:RESERVE_STOCK",
      "request_payload": {
        "order_id": "order-1001"
      },
      "response_payload": {
        "reservation_id": "reservation-1001"
      },
      "retry_count": 0,
      "max_retry_count": 5,
      "next_retry_at": null,
      "error_code": null,
      "error_message": null,
      "external_reference_type": "inventory_reservation",
      "external_reference_id": "reservation-1001",
      "started_at": "2026-05-08T00:00:02Z",
      "completed_at": "2026-05-08T00:00:03Z",
      "created_at": "2026-05-08T00:00:00Z",
      "updated_at": "2026-05-08T00:00:03Z"
    },
    {
      "step_name": "AUTHORIZE_PAYMENT",
      "status": "PROCESSING",
      "step_category": "COMPENSATABLE",
      "recovery_policy": "BACKWARD",
      "idempotency_key": "checkout:1001:AUTHORIZE_PAYMENT",
      "request_payload": {
        "order_id": "order-1001",
        "amount": 18000,
        "currency": "KRW"
      },
      "response_payload": null,
      "retry_count": 0,
      "max_retry_count": 5,
      "next_retry_at": null,
      "error_code": null,
      "error_message": null,
      "external_reference_type": null,
      "external_reference_id": null,
      "started_at": "2026-05-08T00:00:04Z",
      "completed_at": null,
      "created_at": "2026-05-08T00:00:00Z",
      "updated_at": "2026-05-08T00:00:04Z"
    },
    {
      "step_name": "REQUEST_SHIPMENT",
      "status": "READY",
      "step_category": "RETRIABLE",
      "recovery_policy": "FORWARD",
      "idempotency_key": "checkout:1001:REQUEST_SHIPMENT",
      "request_payload": {
        "order_id": "order-1001"
      },
      "response_payload": null,
      "retry_count": 0,
      "max_retry_count": 5,
      "next_retry_at": null,
      "error_code": null,
      "error_message": null,
      "external_reference_type": null,
      "external_reference_id": null,
      "started_at": null,
      "completed_at": null,
      "created_at": "2026-05-08T00:00:00Z",
      "updated_at": "2026-05-08T00:00:00Z"
    }
  ],
  "outbox_events": [
    {
      "event_type": "CHECKOUT_STARTED",
      "event_key": "checkout:1001:CHECKOUT_STARTED:v1",
      "status": "READY",
      "payload": {
        "event_version": "v1",
        "checkout_id": 1001,
        "checkout_key": "checkout-demo-20260508-001"
      },
      "retry_count": 0,
      "created_at": "2026-05-08T00:00:00Z",
      "updated_at": "2026-05-08T00:00:00Z",
      "published_at": null
    }
  ],
  "mode": "db"
}
